{"authorization":"RESEARCH_ONLY_NOT_SHADOW_PAPER_OR_LIVE","decision_contract":{"insufficient_evidence_disposition":"FORWARD_VOLATILITY_PERSISTENCE_EVALUATOR_MANAGER_ACCEPTANCE_MISSING_PROOF","max_candidate_variants":0,"negative_disposition":"FORWARD_VOLATILITY_PERSISTENCE_EVALUATOR_MANAGER_ACCEPTANCE_REJECTED","oos_access":"DENY","outcome_tuning":"DENY","positive_disposition":"FORWARD_VOLATILITY_PERSISTENCE_EVALUATOR_MANAGER_ACCEPTANCE_RECOVERED","stop_condition_count":12,"stop_conditions_sha256":"b2e2db4f106bdb75822b09b4d44e5057d888eabf23c1c0eae77235b806fe84e6"},"dispatch_id":"manager-btc-3pct-volatility-evaluator-acceptance-recovery-v1","execution_mode":"READ_ONLY","issued_at":"2026-08-11T11:08:36Z","local_thread_id":"019fd621-68ce-7802-9eed-5ef87c35d677","manager_thread_id":"019fca63-4f8f-71e3-9d88-297bca468eb9","performance_case":{"causal_mechanism":"A complete BTC UTC day with an absolute move of at least 3 percent may mark a persistent volatility state in which the next complete day's RV24 remains elevated relative to the exact pre-shock 20-day median; the recovery task audits only whether the already committed dormant evaluator for that mechanism has a complete Manager acceptance trace.","claim_boundary":"A positive acceptance-recovery result proves only exact Git lineage, unchanged four-path implementation bytes, a hash-bound Manager receipt for the missing executable schema and regression checks, preserved original BLOCKED history, focused Local safety checks and dormant offline source acceptance. It proves no deployment, canonical activation receipt, forward episode, prediction, causality, significance, strategy mapping, fees, slippage, capacity, matched-capital PnL, drawdown improvement, candidate, OOS or Trading value and authorizes only a separately frozen deployment/activation readiness decision.","drawdown_hypothesis":"Immediate drawdown effect is zero. Any later drawdown effect requires untouched forward evidence plus a separately preregistered matched-capital strategy mapping; this recovery performs neither.","expected_direction":"DIAGNOSTIC_ONLY","opportunity_cost":"One bounded read-only recovery prevents a valid Manager-tested source slice from remaining untraceable while avoiding duplicate implementation or a weakened Local dependency gate. The cost is one NON_COUNTING audit before any separately authorized deployment/activation work.","performance_hypothesis":"Immediate fee-adjusted PnL is unchanged. The only current value is evidence integrity and lower future learning latency; predictive and economic value remain MISSING_PROOF.","primary_metric":"fee_adjusted_total_pnl_delta_under_equal_capital","research_phase":"CAPABILITY"},"policy_binding":{"policy_id":"AUTONOMOUS_TRADING_RESEARCH_V3","policy_sha256":"a82ccff13c13765d1e94a29698a43b35b847ed19190965590fa72e9a102981f6","primary_metric":"fee_adjusted_total_pnl_delta_under_equal_capital"},"schema_version":"1","state_authority":"SERVER_CANONICAL","task_id":"local-node-btc-3pct-volatility-evaluator-acceptance-recovery-v1","task_sha256":"67a29bc19d117c0fa6d3caef5ae52226e060fdc1bd0ac6d3e2366e16bdf00aac","task_type":"CAPABILITY_READINESS","timer_authority":"CODEX_CLOUD_OPS_ONLY"}
