{"authorization":"RESEARCH_ONLY_NOT_SHADOW_PAPER_OR_LIVE","decision_contract":{"insufficient_evidence_disposition":"DRA_DOWNSIDE_SEMIVARIANCE_EVIDENCE_INSUFFICIENT","max_candidate_variants":0,"negative_disposition":"DRA_DOWNSIDE_SEMIVARIANCE_BRANCH_CLOSE","oos_access":"DENY","outcome_tuning":"DENY","positive_disposition":"DRA_DOWNSIDE_SEMIVARIANCE_PRIOR_RETAIN","stop_condition_count":17,"stop_conditions_sha256":"99419bd0880ac47afb5bb5aca1adef28d1d8b8554532a1f062d1d31e1855b522"},"dispatch_id":"manager-dra-downside-semivariance-entry-admission-v1","execution_mode":"READ_ONLY","issued_at":"2026-08-15T11:59:00Z","local_thread_id":"inline-local-node-2026-08-15","manager_thread_id":"019fca63-4f8f-71e3-9d88-297bca468eb9","performance_case":{"causal_mechanism":"A long-only reversal accumulator can mistake a downside-dominated intraday path for a completed reversal. The sign-aware downside-semivariance share distinguishes days whose realized variation is concentrated in negative hourly moves from equally volatile but balanced paths before the unchanged next-open fill.","claim_boundary":"This task may establish only one post-hoc pre-2025 historical mechanism conclusion for exact same-equity DRA V1 with versus without DAILY_DOWNSIDE_SEMIVARIANCE_SHARE_TO_PRIOR_20D_MEDIAN admission. Historical Validation is not clean OOS. A positive result retains a prior for at most one separately frozen hypothesis; it is not independent alpha, a candidate, a runtime filter or Trading authorization. The task cannot inspect post-2024 outcomes, change a threshold, lookback, formula, runner or gate, create a hypothesis or candidate, open OOS, deploy or mutate canonical state.","drawdown_hypothesis":"The feature is valuable only if it avoids downside-heavy false reversals without merely suppressing participation or moving losses into terminal inventory. The frozen equal-capital screen therefore requires PnL breadth, drawdown non-inferiority, holding tails, underwater duration, utilization, realized-lot support and neighbor stability together.","expected_direction":"POSITIVE","opportunity_cost":"The veto can miss profitable capitulation reversals, and the hourly estimator can be too coarse to separate downside risk. One frozen screen either retains the mechanism for one future hypothesis or closes it before new adapter, forward-source or OOS work consumes research capacity.","performance_hypothesis":"Under identical 250 USDT initial equity, effective 240 USDT whole-lot capacity and unchanged DRA V1 economics, admitting signals only when the latest complete day's downside-semivariance-share ratio is at or below 1.0 will improve fee-adjusted total PnL in Design and historical Validation while preserving realized and unrealized components and maintaining acceptable drawdown, holding, underwater, annual-breadth and concentration paths.","primary_metric":"fee_adjusted_total_pnl_delta_under_equal_capital","research_phase":"DIAGNOSTIC"},"policy_binding":{"policy_id":"AUTONOMOUS_TRADING_RESEARCH_V3","policy_sha256":"a82ccff13c13765d1e94a29698a43b35b847ed19190965590fa72e9a102981f6","primary_metric":"fee_adjusted_total_pnl_delta_under_equal_capital"},"schema_version":"1","state_authority":"SERVER_CANONICAL","task_id":"local-node-dra-downside-semivariance-entry-admission-v1","task_sha256":"5548cb4d902a11f4c3ba839bf22e9c6e74f7a11cf525c6e712584a0747706e51","task_type":"EVIDENCE_DIAGNOSTIC","timer_authority":"CODEX_CLOUD_OPS_ONLY"}
