{"authorization":"RESEARCH_ONLY_NOT_SHADOW_PAPER_OR_LIVE","decision_contract":{"insufficient_evidence_disposition":"MISSING_PROOF_MANAGER_VALIDATION_REQUIRED","max_candidate_variants":0,"negative_disposition":"MAIN_CLI_DISPATCH_CLOSURE_REJECT_PRESERVE_STANDALONE_VALIDATOR","oos_access":"DENY","outcome_tuning":"DENY","positive_disposition":"MAIN_CLI_DISPATCH_VALIDATION_READY_FOR_MANAGER_ACCEPTANCE","stop_condition_count":12,"stop_conditions_sha256":"903dbdfb087d0fc20035332605857e47ef30bfb1f30765e70c9edd465e4fe1a7"},"dispatch_id":"manager-local-dispatch-main-cli-closure-v1","execution_mode":"WORKTREE_WRITE","issued_at":"2026-08-09T08:52:00Z","local_thread_id":"019fd621-68ce-7802-9eed-5ef87c35d677","manager_thread_id":"019fca63-4f8f-71e3-9d88-297bca468eb9","performance_case":{"causal_mechanism":"One canonical top-level dispatch command rejects drift and binding errors before Local execution while removing ad hoc invocation differences between Manager task handoffs.","claim_boundary":"This dispatch can prove only the two-file CLI surface, delegation to existing validators, deterministic output and offline fail-closed tests. Runtime productivity, Linux execution, evidence quality, PnL and drawdown remain MISSING_PROOF.","drawdown_hypothesis":"Immediate drawdown effect is zero because the command validates offline research envelopes only and cannot register, execute or promote a trading candidate.","expected_direction":"ZERO_IMMEDIATE_EFFECT","opportunity_cost":"A narrow CLI closure avoids spending future Manager and Local cycles on preventable dispatch syntax or task/result binding mistakes while preserving the already reviewed validator as the single semantic authority.","performance_hypothesis":"Immediate fee-adjusted PnL effect is zero; infrastructure value is shorter and more reliable research-task startup so useful mechanisms can be accepted or rejected with less orchestration overhead.","primary_metric":"fee_adjusted_total_pnl_delta_under_equal_capital","research_phase":"INFRASTRUCTURE"},"policy_binding":{"policy_id":"AUTONOMOUS_TRADING_RESEARCH_V3","policy_sha256":"a82ccff13c13765d1e94a29698a43b35b847ed19190965590fa72e9a102981f6","primary_metric":"fee_adjusted_total_pnl_delta_under_equal_capital"},"schema_version":"1","state_authority":"SERVER_CANONICAL","task_id":"local-node-local-dispatch-main-cli-closure-v1","task_sha256":"932164dbff511395bf6467ed14882f7718e647c9500ced0598426d45c43417c0","task_type":"TOOLING_VERTICAL_SLICE","timer_authority":"CODEX_CLOUD_OPS_ONLY"}
