{"authorization":"RESEARCH_ONLY_NOT_SHADOW_PAPER_OR_LIVE","decision_contract":{"insufficient_evidence_disposition":"OFFICIAL_SOURCE_CONTRACT_INSUFFICIENT","max_candidate_variants":0,"negative_disposition":"NO_CAUSAL_FORWARD_SOURCE_CONTRACT_CLOSE","oos_access":"DENY","outcome_tuning":"DENY","positive_disposition":"ONE_LAGGED_CAUSAL_SOURCE_DESIGN_SELECTED","stop_condition_count":12,"stop_conditions_sha256":"efc32e17fd48d132b7c2c358f5a91ed49f67d869f78c9360ffc114e6eda12006"},"dispatch_id":"manager-dra-crypto-carry-forward-source-design-v1","execution_mode":"READ_ONLY","issued_at":"2026-08-08T16:05:20Z","local_thread_id":"019fd621-68ce-7802-9eed-5ef87c35d677","manager_thread_id":"019fca63-4f8f-71e3-9d88-297bca468eb9","performance_case":{"causal_mechanism":"A forward-only, decision-lagged crypto-carry source may expose derivatives-market crowding and constrained-arbitrage risk before a later BTC spot DRA entry, while preserving the existing entry, exit, capital, accounting and Trading boundaries.","claim_boundary":"This task may select only one raw source-atom design and its causal availability, isolation, missing-data and version boundaries. It cannot call a market endpoint, compute a feature, select an economic parameter, implement or activate capture, or establish prediction, PnL, drawdown, candidate readiness, OOS value, deployability or Trading authority.","drawdown_hypothesis":"Only a later separately frozen forward experiment could show whether a causal carry-conditioned admission veto avoids adverse paths without excessive missed winners; this source-design audit leaves drawdown and false-veto cost MISSING_PROOF.","expected_direction":"ZERO_IMMEDIATE_EFFECT","opportunity_cost":"Selecting one source contract before implementation prevents a convenient but causally late funding feed, unstable formula, incomplete futures inventory or duplicate timer from consuming implementation and forward-evidence time; closing both options is cheaper than collecting unusable data.","performance_hypothesis":"The selected raw source could enable a later preregistered test of fee-adjusted total PnL and drawdown improvement, but this design audit has zero immediate performance effect and makes no alpha claim.","primary_metric":"fee_adjusted_total_pnl_delta_under_equal_capital","research_phase":"DIAGNOSTIC"},"policy_binding":{"policy_id":"AUTONOMOUS_TRADING_RESEARCH_V3","policy_sha256":"a82ccff13c13765d1e94a29698a43b35b847ed19190965590fa72e9a102981f6","primary_metric":"fee_adjusted_total_pnl_delta_under_equal_capital"},"schema_version":"1","state_authority":"SERVER_CANONICAL","task_id":"local-node-dra-crypto-carry-forward-source-design-v1","task_sha256":"32e1539c171a847bb9a8bc087c59e546ed9c86bb262e600c611830884d0cc110","task_type":"EVIDENCE_DIAGNOSTIC","timer_authority":"CODEX_CLOUD_OPS_ONLY"}
