{"authorization":"RESEARCH_ONLY_NOT_SHADOW_PAPER_OR_LIVE","decision_contract":{"insufficient_evidence_disposition":"MISSING_PROOF_MANAGER_EXECUTABLE_VALIDATION_REQUIRED","max_candidate_variants":0,"negative_disposition":"PRODUCER_CORE_REJECTED_PRESERVE_FROZEN_SOURCE_CONTRACT","oos_access":"DENY","outcome_tuning":"DENY","positive_disposition":"EXACT_THREE_FILE_SLICE_READY_FOR_MANAGER_VALIDATION","stop_condition_count":16,"stop_conditions_sha256":"333a4b1dbb03643d3ace90d259b65ee9b554d8001609a41ee132237bf22a274e"},"dispatch_id":"manager-dra-crypto-carry-java-producer-core-v1","execution_mode":"WORKTREE_WRITE","issued_at":"2026-08-09T01:19:53Z","local_thread_id":"019fd621-68ce-7802-9eed-5ef87c35d677","manager_thread_id":"019fca63-4f8f-71e3-9d88-297bca468eb9","performance_case":{"causal_mechanism":"A point-in-time D-1 expiry-futures inventory plus complete confirmed D-day expiry-futures and BTC-USDT index atoms can test whether lagged fixed-maturity carry contains independent DRA admission information without same-day leakage.","claim_boundary":"Acceptance proves only an offline fixed-origin Java producer core and byte-level contract compatibility. It cannot prove public endpoint availability, reliable capture, prediction, fees, slippage, matched-capital PnL, drawdown improvement, deployment, candidate readiness, OOS or Trading authority.","drawdown_hypothesis":"Immediate drawdown effect is zero. A future reduction in adverse DRA entry path or maximum drawdown remains MISSING_PROOF until prospective data supports a preregistered matched-capital Validation and sealed OOS result.","expected_direction":"ZERO_IMMEDIATE_EFFECT","opportunity_cost":"The current carry source is frozen but cannot collect evidence. A bounded producer core reduces time to evidence while avoiding premature filesystem transport, deployment and source registration; failure preserves the accepted source design with no sunk operational surface.","performance_hypothesis":"The producer core cannot improve fee-adjusted total PnL directly, but exact causal capture reduces the latency and evidence-integrity cost of accepting or rejecting one primary-supported carry mechanism without reopening closed exit-management branches.","primary_metric":"fee_adjusted_total_pnl_delta_under_equal_capital","research_phase":"INFRASTRUCTURE"},"policy_binding":{"policy_id":"AUTONOMOUS_TRADING_RESEARCH_V3","policy_sha256":"a82ccff13c13765d1e94a29698a43b35b847ed19190965590fa72e9a102981f6","primary_metric":"fee_adjusted_total_pnl_delta_under_equal_capital"},"schema_version":"1","state_authority":"SERVER_CANONICAL","task_id":"local-node-dra-crypto-carry-java-producer-core-v1","task_sha256":"8062696a0ff5e62fd2ef0d8bc87f2ce6dd185f21cafaac8f29df6cb1e794c71f","task_type":"ADAPTER_IMPLEMENTATION","timer_authority":"CODEX_CLOUD_OPS_ONLY"}
