{"authorization":"RESEARCH_ONLY_NOT_SHADOW_PAPER_OR_LIVE","decision_contract":{"insufficient_evidence_disposition":"PRIMARY_SOURCE_OR_DATA_PATH_EVIDENCE_INSUFFICIENT","max_candidate_variants":0,"negative_disposition":"NO_INCREMENTAL_RETURN_TRAJECTORY_IDEA_CLOSE","oos_access":"DENY","outcome_tuning":"DENY","positive_disposition":"ONE_RETURN_TRAJECTORY_PREREGISTRATION_IDEA_READY","stop_condition_count":12,"stop_conditions_sha256":"95339745dad5db653b81441932d896eb11a25cde47eccdc995d503a558d4d87a"},"dispatch_id":"manager-btc-return-trajectory-preregistration-v4","execution_mode":"READ_ONLY","issued_at":"2026-08-24T11:00:30Z","local_thread_id":"019fd621-68ce-7802-9eed-5ef87c35d677","manager_thread_id":"019fca63-4f8f-71e3-9d88-297bca468eb9","performance_case":{"causal_mechanism":"A completed sequence of returns may encode the stability, concentration or temporal shape of recent price discovery rather than only cumulative sign; only one fixed predecision state with incremental information beyond momentum, reversal, volatility, sign persistence, path efficiency and autocorrelation could justify a later matched-capital screen.","claim_boundary":"This task may use only four frozen access-proven public primary manuscripts, verify only the identity and frozen coverage of the sealed pre-2025 Binance H1 corpus, and use the public OKX complete-candle route only as schema and prospective availability proof. It may return one deterministic low-complexity return-trajectory preregistration skeleton or close the family. FPCA, deep learning, Boruta, technical-rule search and other fitted or outcome-selected methods are non-transferable. Binance-to-OKX venue equivalence remains MISSING_PROOF. It cannot read factor or strategy outcomes, retain market values, train or fit a model, compute PnL or drawdown, register a hypothesis or candidate, run a strategy, open OOS, modify the active forward contract, deploy or activate Trading.","drawdown_hypothesis":"Only a later matched-capital experiment could test whether a predecision trajectory state avoids unstable downside paths without sacrificing broad upside participation. This literature-only task has zero immediate drawdown effect and all magnitude claims remain MISSING_PROOF.","expected_direction":"DIAGNOSTIC_ONLY","opportunity_cost":"A bounded four-source screen can reject fitted-model and technical-rule narratives before runner work, while the one-idea cap and closed-family dedup prevent another price-only variant from displacing the active forward evidence lane.","performance_hypothesis":"If one fixed low-complexity return trajectory has incremental predecision information and later survives equal-capital fees, adverse slippage, large-move stability, annual breadth and drawdown gates, it may improve fee-adjusted total PnL versus an unchanged BTC parent. The present task makes no alpha or performance claim.","primary_metric":"fee_adjusted_total_pnl_delta_under_equal_capital","research_phase":"DIAGNOSTIC"},"policy_binding":{"policy_id":"AUTONOMOUS_TRADING_RESEARCH_V3","policy_sha256":"a82ccff13c13765d1e94a29698a43b35b847ed19190965590fa72e9a102981f6","primary_metric":"fee_adjusted_total_pnl_delta_under_equal_capital"},"schema_version":"1","state_authority":"SERVER_CANONICAL","task_id":"local-node-btc-return-trajectory-preregistration-v4","task_sha256":"ba4a7ed67f6e650fcc7545aae023ddfc4c855541e669a105ac9a1010370dd2f1","task_type":"EVIDENCE_DIAGNOSTIC","timer_authority":"CODEX_CLOUD_OPS_ONLY"}
