{"authorization":"RESEARCH_ONLY_NOT_SHADOW_PAPER_OR_LIVE","decision_contract":{"insufficient_evidence_disposition":"MISSING_PROOF_MANAGER_PACKAGE_AND_LINUX_VALIDATION_REQUIRED","max_candidate_variants":0,"negative_disposition":"CARRY_UNIX_INSTALL_CLOSURE_REJECT_PRESERVE_PACKAGEONLY_CAPABILITY","oos_access":"DENY","outcome_tuning":"DENY","positive_disposition":"EXACT_FIVE_FILE_INACTIVE_CARRY_UNIX_SOURCE_READY_FOR_MANAGER_VALIDATION","stop_condition_count":16,"stop_conditions_sha256":"bd58772191283103cb3fc5e2672db7baad974086f391b1a1e0709f370bf738da"},"dispatch_id":"manager-dra-crypto-carry-inactive-unix-install-closure-v1","execution_mode":"WORKTREE_WRITE","issued_at":"2026-08-09T08:08:04Z","local_thread_id":"019fd621-68ce-7802-9eed-5ef87c35d677","manager_thread_id":"019fca63-4f8f-71e3-9d88-297bca468eb9","performance_case":{"causal_mechanism":"A fixed inactive Unix launcher, isolated source identity and exact release verifier reduce the lead time from an accepted carry package to lawful forward evidence without introducing a second clock or writer.","claim_boundary":"This dispatch can prove only a five-file static inactive installation design. Package execution, Linux identity and systemd enforcement, deployment, registration, evidence, PnL and drawdown remain Manager-side or forward MISSING_PROOF.","drawdown_hypothesis":"Immediate drawdown effect is zero because the unit remains disabled and unbound; any future path-risk improvement requires a separately preregistered matched-capital forward experiment.","expected_direction":"ZERO_IMMEDIATE_EFFECT","opportunity_cost":"Freezing Unix isolation before canonical integration prevents a network-capable source from receiving broad paths or lifecycle authority and avoids spending server capacity on an installation that cannot be safely verified or rolled back.","performance_hypothesis":"Immediate fee-adjusted PnL effect is zero; the infrastructure value is faster, fail-closed installation of a future carry evidence source so the causal DRA admission mechanism can be accepted or rejected sooner.","primary_metric":"fee_adjusted_total_pnl_delta_under_equal_capital","research_phase":"INFRASTRUCTURE"},"policy_binding":{"policy_id":"AUTONOMOUS_TRADING_RESEARCH_V3","policy_sha256":"a82ccff13c13765d1e94a29698a43b35b847ed19190965590fa72e9a102981f6","primary_metric":"fee_adjusted_total_pnl_delta_under_equal_capital"},"schema_version":"1","state_authority":"SERVER_CANONICAL","task_id":"local-node-dra-crypto-carry-inactive-unix-install-closure-v1","task_sha256":"4c634dafc4de16b939c88cc7367870a18cb087b4a6b579d2c6a03d1b0fefc6e2","task_type":"TOOLING_VERTICAL_SLICE","timer_authority":"CODEX_CLOUD_OPS_ONLY"}
