{"authorization":"RESEARCH_ONLY_NOT_SHADOW_PAPER_OR_LIVE","decision_contract":{"insufficient_evidence_disposition":"WEEKLY_LOCAL_OUTPUT_ACCEPTANCE_OR_CLASSIFICATION_PROOF_INSUFFICIENT","max_candidate_variants":0,"negative_disposition":"WEEKLY_LOCAL_OUTPUT_TARGET_NOT_MET_PRESERVE_EXACT_SHORTFALL","oos_access":"DENY","outcome_tuning":"DENY","positive_disposition":"WEEKLY_LOCAL_OUTPUT_TARGET_PROVEN_CLASSIFICATION_CONTRACT_REQUIRED","stop_condition_count":18,"stop_conditions_sha256":"d930f3dae06b6fe745c4bddceb31201b917bbbb91c967059cedb40d5f243bf40"},"dispatch_id":"manager-local-weekly-output-evidence-matrix-audit-v1","execution_mode":"READ_ONLY","issued_at":"2026-08-10T13:31:00Z","local_thread_id":"019fd621-68ce-7802-9eed-5ef87c35d677","manager_thread_id":"019fca63-4f8f-71e3-9d88-297bca468eb9","performance_case":{"causal_mechanism":"Accepted Local Research learning is currently absent from the canonical experiment-only weekly brief. A hash-bound explicit output matrix can prevent useful mechanism and capability work from being invisible, repeated or confused with infrastructure activity.","claim_boundary":"This dispatch may validate and classify only the exact three frozen accepted Local closures and design the minimum later read-only classification contract. It cannot scan other results, change canonical reporting or state, implement a tool, add a timer, inspect market outcomes, create a strategy, register a hypothesis or candidate, open OOS, deploy or perform any Trading action.","drawdown_hypothesis":"Immediate drawdown effect is zero. The two counted mechanism conclusions are historical descriptive evidence and the capability slice contains no economic ledger, so forward path risk and every matched-capital drawdown claim remain MISSING_PROOF.","expected_direction":"ZERO_IMMEDIATE_EFFECT","opportunity_cost":"One bounded matrix audit costs little and prevents a larger premature reporting integration. It also identifies whether explicit classification metadata is required before automation, preserving research capacity for the active 14-day R2 evidence lane.","performance_hypothesis":"The audit itself cannot improve fee-adjusted total PnL. Its research value is accurate weekly learning visibility: count accepted evidence conclusions and capability slices without inflating throughput through source, infrastructure or scheduling tasks, thereby reducing duplicate work and shortening time to the next falsifiable question.","primary_metric":"fee_adjusted_total_pnl_delta_under_equal_capital","research_phase":"DIAGNOSTIC"},"policy_binding":{"policy_id":"AUTONOMOUS_TRADING_RESEARCH_V3","policy_sha256":"a82ccff13c13765d1e94a29698a43b35b847ed19190965590fa72e9a102981f6","primary_metric":"fee_adjusted_total_pnl_delta_under_equal_capital"},"schema_version":"1","state_authority":"SERVER_CANONICAL","task_id":"local-node-local-weekly-output-evidence-matrix-audit-v1","task_sha256":"4e44f09b5ee1c4c44876f4d86425011d41ee1ce23c950814c5a70ff5e696018d","task_type":"EVIDENCE_DIAGNOSTIC","timer_authority":"CODEX_CLOUD_OPS_ONLY"}
