{"authorization":"RESEARCH_ONLY_NOT_SHADOW_PAPER_OR_LIVE","decision_contract":{"insufficient_evidence_disposition":"PUBLIC_SOURCE_BRANCH_INTEGRITY_BLOCKED","max_candidate_variants":0,"negative_disposition":"NO_PUBLIC_FACTOR_SOURCE_EVIDENCE_READY_WAIT","oos_access":"DENY","outcome_tuning":"DENY","positive_disposition":"ONE_PUBLIC_SOURCE_CONTRACT_READY_FOR_LATER_REVIEW","stop_condition_count":16,"stop_conditions_sha256":"47f5ea883f9d8b44ab09db00d4132b2cf5209ba81a3ac60d871a7e8e87bf5509"},"dispatch_id":"manager-public-forward-source-branch-closure-matrix-v1","execution_mode":"READ_ONLY","issued_at":"2026-08-10T10:31:00Z","local_thread_id":"019fd621-68ce-7802-9eed-5ef87c35d677","manager_thread_id":"019fca63-4f8f-71e3-9d88-297bca468eb9","performance_case":{"causal_mechanism":"Evidence reuse and explicit branch closure prevent engineering churn and source-selection bias; this diagnostic makes no immediate strategy-mechanism claim.","claim_boundary":"This dispatch proves only a source-readiness closure matrix from sealed inputs; it cannot perform live source retrieval, define or implement a factor, claim PnL or drawdown improvement, deploy, register a candidate, open OOS, change canonical state or schedule, or perform any Trading action.","drawdown_hypothesis":"Immediate drawdown effect is zero; any future drawdown effect remains MISSING_PROOF.","expected_direction":"ZERO_IMMEDIATE_EFFECT","opportunity_cost":"Repeated CFTC parser and documentation work displaces forward post-shock and R2 evidence collection; explicit close or wait dispositions free research capacity without weakening evidence gates.","performance_hypothesis":"Immediate fee-adjusted PnL effect is zero. The knowledge value is preventing duplicate source work, preserving capital and evidence integrity, and reserving implementation effort for a source with accepted point-in-time proof.","primary_metric":"fee_adjusted_total_pnl_delta_under_equal_capital","research_phase":"DIAGNOSTIC"},"policy_binding":{"policy_id":"AUTONOMOUS_TRADING_RESEARCH_V3","policy_sha256":"a82ccff13c13765d1e94a29698a43b35b847ed19190965590fa72e9a102981f6","primary_metric":"fee_adjusted_total_pnl_delta_under_equal_capital"},"schema_version":"1","state_authority":"SERVER_CANONICAL","task_id":"local-node-public-forward-source-branch-closure-matrix-v1","task_sha256":"c568e9039a1e6783bf51a9338f390ca1856f8cccc73974dadcb742bda0ded3f6","task_type":"EVIDENCE_DIAGNOSTIC","timer_authority":"CODEX_CLOUD_OPS_ONLY"}
