{"authorization":"RESEARCH_ONLY_NOT_SHADOW_PAPER_OR_LIVE","decision_contract":{"insufficient_evidence_disposition":"CFTC_TFF_LIVE_LAYOUT_UNAVAILABLE_OR_AMBIGUOUS","max_candidate_variants":0,"negative_disposition":"CFTC_TFF_LIVE_LAYOUT_REQUIRES_REFREEZE","oos_access":"DENY","outcome_tuning":"DENY","positive_disposition":"CFTC_TFF_LIVE_LAYOUT_COMPATIBLE","stop_condition_count":16,"stop_conditions_sha256":"4fc5f6af9af87fea8e99894fadadb456ee44e090d6c74c2ee86168bda7822ed2"},"dispatch_id":"manager-cftc-cme-bitcoin-tff-live-layout-compatibility-v1","execution_mode":"READ_ONLY","issued_at":"2026-08-10T09:05:00Z","local_thread_id":"019fd621-68ce-7802-9eed-5ef87c35d677","manager_thread_id":"019fca63-4f8f-71e3-9d88-297bca468eb9","performance_case":{"causal_mechanism":"Weekly regulator-aggregated CME Bitcoin trader positioning may eventually provide a slow institutional risk-state input distinct from spot price, microstructure, carry and post-shock labels, but only if the current official file structurally matches a leak-free deterministic source contract.","claim_boundary":"A positive result proves only that one current public CFTC response matches the frozen V1 transport and parser layout assumptions. It does not prove future stability, release eligibility, field meaning, predictive value, factor direction, PnL, drawdown, deployment, source registration, OOS authority or any Trading action.","drawdown_hypothesis":"Immediate drawdown effect is zero. Any future drawdown reduction remains MISSING_PROOF until a separately preregistered field interpretation passes forward predictive breadth and equal-capital economic and path-risk gates.","expected_direction":"ZERO_IMMEDIATE_EFFECT","opportunity_cost":"One bounded structural request is cheaper than deploying an incompatible producer. If the live layout differs, close V1 for operational use and refreeze only the minimum V2 structural changes; if evidence is unavailable, do not spend further implementation capacity on capture.","performance_hypothesis":"This diagnostic has zero immediate fee-adjusted PnL effect. Its capability value is preventing synthetic-test success from being mistaken for live-source readiness and preserving engineering capacity for only structurally viable evidence sources.","primary_metric":"fee_adjusted_total_pnl_delta_under_equal_capital","research_phase":"DIAGNOSTIC"},"policy_binding":{"policy_id":"AUTONOMOUS_TRADING_RESEARCH_V3","policy_sha256":"a82ccff13c13765d1e94a29698a43b35b847ed19190965590fa72e9a102981f6","primary_metric":"fee_adjusted_total_pnl_delta_under_equal_capital"},"schema_version":"1","state_authority":"SERVER_CANONICAL","task_id":"local-node-cftc-cme-bitcoin-tff-live-layout-compatibility-v1","task_sha256":"ab685d1bebf136a2a3edc148985de5ca608682a93998fd3ca63bbec05206d2e9","task_type":"EVIDENCE_DIAGNOSTIC","timer_authority":"CODEX_CLOUD_OPS_ONLY"}
