{"authorization":"RESEARCH_ONLY_NOT_SHADOW_PAPER_OR_LIVE","decision_contract":{"insufficient_evidence_disposition":"POST_SHOCK_ACTIONABILITY_ACCEPTANCE_MISSING_PROOF","max_candidate_variants":0,"negative_disposition":"POST_SHOCK_ACTIONABILITY_CAPABILITY_REJECTED","oos_access":"DENY","outcome_tuning":"DENY","positive_disposition":"POST_SHOCK_ACTIONABILITY_CAPABILITY_ACCEPTED","stop_condition_count":14,"stop_conditions_sha256":"9a8d53d06480eb311ce1a989c8cc7b97c4515921cc06f8951b75dcdc5ec854f6"},"dispatch_id":"manager-btc-utc-day-3pct-post-shock-actionability-acceptance-recovery-v1","execution_mode":"READ_ONLY","issued_at":"2026-08-11T12:34:52Z","local_thread_id":"019fd621-68ce-7802-9eed-5ef87c35d677","manager_thread_id":"019fca63-4f8f-71e3-9d88-297bca468eb9","performance_case":{"causal_mechanism":"A post-shock strategy claim is causal only when the terminal discovery result and semantic Manager review are hash-bound before untouched future evidence, decision availability is the exact maximum of artifact clocks, and a deterministic later fill observation is independently bound rather than borrowed from the discovery response.","claim_boundary":"A positive result proves only offline acceptance of the already committed closed parent-neutral actionability schema, pure builder and validator, synthetic timing and hash tests, exact lineage and bounded documentation. It proves no real terminal factor, actual latency, strategy direction, parent or adapter compatibility, fees, slippage, PnL, drawdown, candidate readiness, OOS, deployment or Trading value and authorizes no write or execution.","drawdown_hypothesis":"Immediate drawdown effect is zero. Drawdown and path risk remain MISSING_PROOF until a separately frozen parent, adapter, capital, fee, slippage and economic ledger consume genuinely untouched post-activation evidence.","expected_direction":"ZERO_IMMEDIATE_EFFECT","opportunity_cost":"Closing the offline acceptance gap prevents the already implemented four-file capability from remaining scientifically untrusted or being reimplemented after outcomes. A rejection stops use at the exact failed proof; acceptance permits only a later separately frozen strategy-readiness audit after untouched evidence exists.","performance_hypothesis":"Immediate fee-adjusted total PnL effect is zero. The only present value is lower research latency and stronger protection against t0-to-h24 discovery leakage before any strategy or economic evaluation is selected.","primary_metric":"fee_adjusted_total_pnl_delta_under_equal_capital","research_phase":"CAPABILITY"},"policy_binding":{"policy_id":"AUTONOMOUS_TRADING_RESEARCH_V3","policy_sha256":"a82ccff13c13765d1e94a29698a43b35b847ed19190965590fa72e9a102981f6","primary_metric":"fee_adjusted_total_pnl_delta_under_equal_capital"},"schema_version":"1","state_authority":"SERVER_CANONICAL","task_id":"local-node-btc-utc-day-3pct-post-shock-actionability-acceptance-recovery-v1","task_sha256":"8c8c74f779855d6b60e02b4f08bc264729cc0d9d4f4608c929dd2034e91a6f16","task_type":"CAPABILITY_READINESS","timer_authority":"CODEX_CLOUD_OPS_ONLY"}
