{"authorization":"RESEARCH_ONLY_NOT_SHADOW_PAPER_OR_LIVE","decision_contract":{"insufficient_evidence_disposition":"POST_SHOCK_ACTIONABILITY_CAPABILITY_REQUIRED","max_candidate_variants":0,"negative_disposition":"POST_SHOCK_STRATEGY_ROUTE_INCOMPATIBLE_CLOSE","oos_access":"DENY","outcome_tuning":"DENY","positive_disposition":"POST_SHOCK_STRATEGY_SPEC_READY","stop_condition_count":18,"stop_conditions_sha256":"6d76098aa6bc81a90e3bf5ad6f189c9a14af066fc773c96f492fb36ef699ada4"},"dispatch_id":"manager-btc-3pct-post-shock-strategy-readiness-audit-v1","execution_mode":"READ_ONLY","issued_at":"2026-08-10T11:56:02Z","local_thread_id":"019fd621-68ce-7802-9eed-5ef87c35d677","manager_thread_id":"019fca63-4f8f-71e3-9d88-297bca468eb9","performance_case":{"causal_mechanism":"A post-shock effect is executable only after complete target evidence has been received, its diagnostic has been sealed and a Manager-visible decision exists; any fill must be strictly later and use a separately frozen point-in-time price. The t0-to-h24 discovery label therefore cannot itself be treated as achievable strategy PnL.","claim_boundary":"This dispatch audits only frozen static contracts and cannot inspect real post-activation outcomes or market data, select continuation or reversal, define a parent or strategy, change the h24 response, implement or register an adapter, compute an equity curve, register a hypothesis or candidate, open OOS, deploy, write canonical state or perform any Trading action.","drawdown_hypothesis":"Immediate drawdown effect is zero. Drawdown, underwater duration, holding age and terminal inventory remain MISSING_PROOF until a causal fill contract, matched-capital parent, fees, slippage and separate future evidence are frozen and evaluated.","expected_direction":"ZERO_IMMEDIATE_EFFECT","opportunity_cost":"A bounded readiness audit prevents discovery-label leakage and incompatible DRA adapter reuse before implementation effort or candidate budget is spent. If a finite gap exists, it should identify exactly one additive pre-outcome capability slice and stop.","performance_hypothesis":"The audit cannot improve fee-adjusted PnL. Its value is determining whether an honest strategy specification could be frozen after a future positive factor result without using information before availability, discovery data as OOS, or an incompatible parent and adapter.","primary_metric":"fee_adjusted_total_pnl_delta_under_equal_capital","research_phase":"CAPABILITY"},"policy_binding":{"policy_id":"AUTONOMOUS_TRADING_RESEARCH_V3","policy_sha256":"a82ccff13c13765d1e94a29698a43b35b847ed19190965590fa72e9a102981f6","primary_metric":"fee_adjusted_total_pnl_delta_under_equal_capital"},"schema_version":"1","state_authority":"SERVER_CANONICAL","task_id":"local-node-btc-3pct-post-shock-strategy-readiness-audit-v1","task_sha256":"177c051cbaa08054c911b7fc21ad6533088aaa0c59fcce9b941837ecc7767f1a","task_type":"CAPABILITY_READINESS","timer_authority":"CODEX_CLOUD_OPS_ONLY"}
