{"authorization":"RESEARCH_ONLY_NOT_SHADOW_PAPER_OR_LIVE","decision_contract":{"insufficient_evidence_disposition":"MISSING_PROOF_MANAGER_VALIDATION_REQUIRED","max_candidate_variants":0,"negative_disposition":"STATIC_IMPLEMENTATION_REJECTED_PRESERVE_SOURCE_DESIGN","oos_access":"DENY","outcome_tuning":"DENY","positive_disposition":"FIVE_FILE_SLICE_READY_FOR_MANAGER_EXECUTABLE_VALIDATION","stop_condition_count":16,"stop_conditions_sha256":"59f29f48dc79eae91bb0c0a2b996c748298fe0276ef0361dcdedf7965fbcd218"},"dispatch_id":"manager-dra-crypto-carry-forward-source-contract-freeze-v2","execution_mode":"WORKTREE_WRITE","issued_at":"2026-08-08T16:31:45Z","local_thread_id":"019fd621-68ce-7802-9eed-5ef87c35d677","manager_thread_id":"019fca63-4f8f-71e3-9d88-297bca468eb9","performance_case":{"causal_mechanism":"A point-in-time D-1 expiry-futures inventory plus complete confirmed D-day futures and index raw atoms can test whether lagged fixed-maturity crypto carry contains independent admission information without same-day leakage.","claim_boundary":"Local completion proves only static creation of five offline files. Manager executable validation is mandatory before acceptance, and neither layer can prove endpoint availability, prediction, fees, slippage, matched-capital PnL, drawdown improvement, candidate readiness, deployment, OOS or Trading authority.","drawdown_hypothesis":"Immediate drawdown effect is zero. Any future reduction in adverse DRA entry path or maximum drawdown remains MISSING_PROOF until a preregistered matched-capital experiment passes Validation and sealed OOS.","expected_direction":"ZERO_IMMEDIATE_EFFECT","opportunity_cost":"Failing closed on Local Python made no progress but preserved evidence integrity. Moving executable acceptance to Manager recovers implementation throughput without sandbox permission prompts; a bad five-file slice is still rejected before commit, source activation or evidence collection.","performance_hypothesis":"The contract cannot improve fee-adjusted total PnL directly, but it reduces time to a credible accept-or-reject test of one primary-supported carry mechanism while preventing after-the-fact instrument selection, backfill and duplicate funding work.","primary_metric":"fee_adjusted_total_pnl_delta_under_equal_capital","research_phase":"INFRASTRUCTURE"},"policy_binding":{"policy_id":"AUTONOMOUS_TRADING_RESEARCH_V3","policy_sha256":"a82ccff13c13765d1e94a29698a43b35b847ed19190965590fa72e9a102981f6","primary_metric":"fee_adjusted_total_pnl_delta_under_equal_capital"},"schema_version":"1","state_authority":"SERVER_CANONICAL","task_id":"local-node-dra-crypto-carry-forward-source-contract-freeze-v2","task_sha256":"53e79bfb05da31f05684cdfb133ee9f068c0ecc7e9716415eca008ab151db6ff","task_type":"TOOLING_VERTICAL_SLICE","timer_authority":"CODEX_CLOUD_OPS_ONLY"}
