{"authorization":"RESEARCH_ONLY_NOT_SHADOW_PAPER_OR_LIVE","decision_contract":{"insufficient_evidence_disposition":"MISSING_PROOF_MANAGER_VALIDATION_REQUIRED","max_candidate_variants":0,"negative_disposition":"ACTIONABILITY_CAPABILITY_IMPLEMENTATION_REJECT_PRESERVE_READINESS_AUDIT","oos_access":"DENY","outcome_tuning":"DENY","positive_disposition":"ACTIONABILITY_CAPABILITY_SOURCE_READY_FOR_MANAGER_VALIDATION","stop_condition_count":19,"stop_conditions_sha256":"62980598950772abbbff445ca9679af9351f62b68a917cbbab265ac6a63d1a47"},"dispatch_id":"manager-btc-3pct-post-shock-actionability-capability-v1","execution_mode":"WORKTREE_WRITE","issued_at":"2026-08-10T12:07:43Z","local_thread_id":"019fd621-68ce-7802-9eed-5ef87c35d677","manager_thread_id":"019fca63-4f8f-71e3-9d88-297bca468eb9","performance_case":{"causal_mechanism":"A post-shock strategy claim is causal only when the terminal discovery result and semantic Manager review are hash-bound before untouched future evidence, decision availability is the exact maximum of artifact clocks, and a deterministic later fill observation is independently bound rather than borrowed from the discovery response.","claim_boundary":"A positive implementation proves only a closed parent-neutral actionability schema, pure builder/validator, synthetic timing/hash tests and bounded documentation. It cannot prove a real terminal factor, actual latency, strategy direction, parent or adapter compatibility, fees, slippage, PnL, drawdown, candidate readiness, OOS, deployment or Trading value.","drawdown_hypothesis":"Immediate drawdown effect is zero. Drawdown and path risk remain MISSING_PROOF until a separately frozen parent, adapter, capital, fee, slippage and economic ledger consume genuinely untouched post-activation evidence.","expected_direction":"ZERO_IMMEDIATE_EFFECT","opportunity_cost":"The four-file offline slice prevents t0-to-h24 discovery leakage and incompatible DRA adapter reuse before candidate budget is spent. Its cost is delaying strategy specification until a later real terminal factor and causal fill record exist.","performance_hypothesis":"This slice cannot improve fee-adjusted PnL. Its research value is making later positive factor evidence actionable without lookahead by freezing exact availability and point-in-time fill identities before any strategy or economic evaluation is selected.","primary_metric":"fee_adjusted_total_pnl_delta_under_equal_capital","research_phase":"CAPABILITY"},"policy_binding":{"policy_id":"AUTONOMOUS_TRADING_RESEARCH_V3","policy_sha256":"a82ccff13c13765d1e94a29698a43b35b847ed19190965590fa72e9a102981f6","primary_metric":"fee_adjusted_total_pnl_delta_under_equal_capital"},"schema_version":"1","state_authority":"SERVER_CANONICAL","task_id":"local-node-btc-3pct-post-shock-actionability-capability-v1","task_sha256":"42e5a5e507787669c5d45c86605d692b20030b3e34a2616e5874170c898d32ae","task_type":"TOOLING_VERTICAL_SLICE","timer_authority":"CODEX_CLOUD_OPS_ONLY"}
