{"authorization":"RESEARCH_ONLY_NOT_SHADOW_PAPER_OR_LIVE","decision_contract":{"insufficient_evidence_disposition":"CFTC_TFF_HEADERLESS_OFFLINE_V2_WAIT","max_candidate_variants":0,"negative_disposition":"CFTC_TFF_HEADERLESS_OFFLINE_V2_CLOSE","oos_access":"DENY","outcome_tuning":"DENY","positive_disposition":"CFTC_TFF_HEADERLESS_OFFLINE_V2_READY","stop_condition_count":18,"stop_conditions_sha256":"dcc057e0b30e8f963303bec5f22fd681539481968361a7053e318503fb859f60"},"dispatch_id":"manager-cftc-tff-headerless-offline-v2-implementation-v1","execution_mode":"WORKTREE_WRITE","issued_at":"2026-08-10T14:56:00Z","local_thread_id":"019fd621-68ce-7802-9eed-5ef87c35d677","manager_thread_id":"019fca63-4f8f-71e3-9d88-297bca468eb9","performance_case":{"causal_mechanism":"A headerless regulator source can support future causal factor research only if one disabled offline parser encodes the accepted positional and date contract exactly while preserving all release, identity, sealing and no-lookahead gates.","claim_boundary":"A positive result proves only that five additive disabled offline V2 files implement the accepted headerless positional contract against synthetic fixtures while preserving V1 bytes and research boundaries. It proves no live source stability, registration, capture, factor validity, predictive value, PnL, drawdown, candidate readiness, OOS authority, deployment or Trading action.","drawdown_hypothesis":"Immediate drawdown effect is zero. Any future path-risk benefit remains MISSING_PROOF until a separately preregistered factor passes forward matched-capital economic and drawdown gates.","expected_direction":"ZERO_IMMEDIATE_EFFECT","opportunity_cost":"One bounded five-file slice converts accepted transport evidence into reusable offline capability and prevents repeated parser speculation. Stop after exact tests; do not spend on runtime integration, capture or factor selection.","performance_hypothesis":"This implementation has zero immediate fee-adjusted PnL effect. Its capability value is a deterministic fail-closed parser that can later support one separately authorized forward factor review without reopening V1 or using outcome-informed repair.","primary_metric":"fee_adjusted_total_pnl_delta_under_equal_capital","research_phase":"CAPABILITY"},"policy_binding":{"policy_id":"AUTONOMOUS_TRADING_RESEARCH_V3","policy_sha256":"a82ccff13c13765d1e94a29698a43b35b847ed19190965590fa72e9a102981f6","primary_metric":"fee_adjusted_total_pnl_delta_under_equal_capital"},"schema_version":"1","state_authority":"SERVER_CANONICAL","task_id":"local-node-cftc-tff-headerless-offline-v2-implementation-v1","task_sha256":"eb76060597d46c9fa6cc6365d699f99904576782a80d798a59a43ab56ba756f2","task_type":"TOOLING_VERTICAL_SLICE","timer_authority":"CODEX_CLOUD_OPS_ONLY"}
