{"authorization":"RESEARCH_ONLY_NOT_SHADOW_PAPER_OR_LIVE","decision_contract":{"insufficient_evidence_disposition":"CFTC_TFF_LEV_MONEY_FACTOR_EVALUATOR_INTEGRITY_BLOCKED","max_candidate_variants":0,"negative_disposition":"CFTC_TFF_LEV_MONEY_FACTOR_EVALUATOR_IMPLEMENTATION_REJECT","oos_access":"DENY","outcome_tuning":"DENY","positive_disposition":"CFTC_TFF_LEV_MONEY_FACTOR_EVALUATOR_READY","stop_condition_count":22,"stop_conditions_sha256":"e3416395863c9c04b72c3a5b34ad0771d0313226ccc1255fa84a1222b3c8f561"},"dispatch_id":"manager-cftc-tff-lev-money-net-pct-oi-delta-evaluator-v1","execution_mode":"WORKTREE_WRITE","issued_at":"2026-08-10T16:24:00Z","local_thread_id":"019fd621-68ce-7802-9eed-5ef87c35d677","manager_thread_id":"019fca63-4f8f-71e3-9d88-297bca468eb9","performance_case":{"causal_mechanism":"A week-over-week increase in Leveraged Money net long-minus-short percentage of open interest may represent persistent speculative positioning; if persistent rather than basis, carry or hedging composition, its sign should align with the next nonoverlapping 168-hour BTC return. This task implements only the frozen falsification machinery using synthetic evidence.","claim_boundary":"A positive task result proves only that one pure synthetic-only offline evaluator contract correctly implements the exact preregistered factor formula, sealed-observation and canonical-row bindings, fixed 168-hour nonoverlapping evaluation and frozen gates. It does not prove source continuity, first-close truth on real evidence, predictive value, statistical significance on real observations, matched-capital PnL, drawdown improvement, fees, slippage, turnover, capacity, annual or regime breadth, candidate readiness, OOS authority, deployment or Trading action; it remains NON_COUNTING and authorizes no real capture or evaluation.","drawdown_hypothesis":"Immediate drawdown effect is zero. A future spot-only BUY-admission versus HOLD_CASH overlay could improve drawdown only after the exact factor passes independent real forward prediction, equal-capital economic and path-risk gates; the synthetic evaluator itself supplies no such evidence.","expected_direction":"ZERO_IMMEDIATE_EFFECT","opportunity_cost":"Implementing the evaluator now removes later discretionary formula, sign, overlap and gate choices while R2 accumulates independently. The cost is a bounded five-file maintenance slice and at least 26 weekly nonzero nonoverlapping transitions before any positive review; no real-data work is authorized here.","performance_hypothesis":"Immediate fee-adjusted total PnL effect is zero. The current performance value is evidence quality: a deterministic evaluator makes one slow public factor falsifiable without post-outcome sign, field, horizon, overlap or breadth changes, so a failed continuation route can be closed cleanly.","primary_metric":"fee_adjusted_total_pnl_delta_under_equal_capital","research_phase":"CAPABILITY"},"policy_binding":{"policy_id":"AUTONOMOUS_TRADING_RESEARCH_V3","policy_sha256":"a82ccff13c13765d1e94a29698a43b35b847ed19190965590fa72e9a102981f6","primary_metric":"fee_adjusted_total_pnl_delta_under_equal_capital"},"schema_version":"1","state_authority":"SERVER_CANONICAL","task_id":"local-node-cftc-tff-lev-money-net-pct-oi-delta-evaluator-v1","task_sha256":"32d3174d06a8b938141b31434e17576eaf8b2d852aec6313cd3e5bf7e4ec8550","task_type":"TOOLING_VERTICAL_SLICE","timer_authority":"CODEX_CLOUD_OPS_ONLY"}
