{"authorization":"RESEARCH_ONLY_NOT_SHADOW_PAPER_OR_LIVE","decision_contract":{"insufficient_evidence_disposition":"V7_PROMPT_AUDIT_MISSING_PROOF","max_candidate_variants":0,"negative_disposition":"V7_PROMPT_CONTRADICTION_FOUND_HOLD_ACTIVATION","oos_access":"DENY","outcome_tuning":"DENY","positive_disposition":"V7_PROMPT_CONSISTENT_READY_FOR_PLATFORM_BINDING","stop_condition_count":10,"stop_conditions_sha256":"9f9036cee33f238d72bec365f501a9784731bc12d32acf7a77debe759546fb36"},"dispatch_id":"manager-cloud-ops-v7-prompt-consistency-audit-v1","execution_mode":"READ_ONLY","issued_at":"2026-08-08T07:33:12Z","local_thread_id":"019fd621-68ce-7802-9eed-5ef87c35d677","manager_thread_id":"019fca63-4f8f-71e3-9d88-297bca468eb9","performance_case":{"causal_mechanism":"A single internally consistent V7 cloud prompt can invoke the normally due canonical heartbeat with the exact server-accepted attestation and preserve durable same-chat Coach delivery without a second clock or cross-task dependency.","claim_boundary":"This task may establish only repository prompt-to-contract consistency. It cannot prove platform same-chat binding, one active recurrence, unattended context visibility, heartbeat execution, receipt acceptance, PnL, drawdown, candidate readiness, OOS value, or Trading authority.","drawdown_hypothesis":"The prompt audit has zero immediate drawdown effect; only later evidence-bound strategies can establish drawdown improvement, while preventing failed research cycles protects evidence continuity rather than market risk.","expected_direction":"ZERO_IMMEDIATE_EFFECT","opportunity_cost":"A false positive could activate a contradictory schedule and lose evidence or Coach delivery cycles; a false negative delays the single cloud clock, so every negative finding must cite an exact listed byte and every platform claim remains MISSING_PROOF.","performance_hypothesis":"This consistency audit cannot improve fee-adjusted PnL directly, but preventing stale V6 attestation or delivery instructions may reduce failed cloud cycles and shorten time to trustworthy V3 evidence and later strategy decisions.","primary_metric":"fee_adjusted_total_pnl_delta_under_equal_capital","research_phase":"CAPABILITY"},"policy_binding":{"policy_id":"AUTONOMOUS_TRADING_RESEARCH_V3","policy_sha256":"a82ccff13c13765d1e94a29698a43b35b847ed19190965590fa72e9a102981f6","primary_metric":"fee_adjusted_total_pnl_delta_under_equal_capital"},"schema_version":"1","state_authority":"SERVER_CANONICAL","task_id":"local-node-cloud-ops-v7-prompt-consistency-audit-v1","task_sha256":"8485d2e8fa7fa12e5adb2ab6efd1dec84ae1917b43271756c9793321051bacb5","task_type":"CAPABILITY_READINESS","timer_authority":"CODEX_CLOUD_OPS_ONLY"}
