{
  "schema_version": "1",
  "dispatch_id": "manager-cftc-tff-headerless-transport-proof-v1",
  "issued_at": "2026-08-10T14:41:00Z",
  "manager_thread_id": "019fca63-4f8f-71e3-9d88-297bca468eb9",
  "local_thread_id": "019fd621-68ce-7802-9eed-5ef87c35d677",
  "task_id": "local-node-cftc-tff-headerless-transport-proof-v1",
  "task_sha256": "97733a2f0018e4b4a0b1e8e20de02746e33e734bfd2f67bf806bb0e02ee4d647",
  "task_type": "EVIDENCE_DIAGNOSTIC",
  "execution_mode": "READ_ONLY",
  "performance_case": {
    "research_phase": "DIAGNOSTIC",
    "causal_mechanism": "A regulator-aggregated CME Bitcoin risk-state source is research-usable only when its current public file can be parsed causally and exactly without treating the first positional data row as a header or applying outcome-informed repair.",
    "performance_hypothesis": "This diagnostic has zero immediate fee-adjusted PnL effect. Its capability value is to validate or close the minimum safe public-source transport contract before any factor formula or strategy work consumes research capacity.",
    "primary_metric": "fee_adjusted_total_pnl_delta_under_equal_capital",
    "expected_direction": "ZERO_IMMEDIATE_EFFECT",
    "drawdown_hypothesis": "Immediate drawdown effect is zero. Any future drawdown reduction remains MISSING_PROOF until a separately preregistered factor passes forward economic and path-risk gates.",
    "opportunity_cost": "One fixed-enum confirmation avoids repeated parser work and false factor experiments. Close the route if the contract is not exact; otherwise cap the next spend at one additive disabled offline V2 implementation slice.",
    "claim_boundary": "A positive result proves only that one current official response conforms to the fixed headerless positional transport contract suitable for a separate disabled offline V2 implementation. It proves no future source stability, factor validity, predictive value, PnL, drawdown, candidate readiness, OOS authority, deployment or Trading action."
  },
  "decision_contract": {
    "positive_disposition": "CFTC_TFF_HEADERLESS_TRANSPORT_READY",
    "negative_disposition": "CFTC_TFF_HEADERLESS_TRANSPORT_CLOSE",
    "insufficient_evidence_disposition": "CFTC_TFF_HEADERLESS_TRANSPORT_WAIT",
    "stop_condition_count": 16,
    "stop_conditions_sha256": "73ada27bca17a5cd4ae08e386da6bcd6c766bc5719ea6b50d87cf762f2103c3b",
    "max_candidate_variants": 0,
    "outcome_tuning": "DENY",
    "oos_access": "DENY"
  },
  "policy_binding": {
    "policy_id": "AUTONOMOUS_TRADING_RESEARCH_V3",
    "policy_sha256": "a82ccff13c13765d1e94a29698a43b35b847ed19190965590fa72e9a102981f6",
    "primary_metric": "fee_adjusted_total_pnl_delta_under_equal_capital"
  },
  "authorization": "RESEARCH_ONLY_NOT_SHADOW_PAPER_OR_LIVE",
  "state_authority": "SERVER_CANONICAL",
  "timer_authority": "CODEX_CLOUD_OPS_ONLY"
}
