{"authorization":"RESEARCH_ONLY_NOT_SHADOW_PAPER_OR_LIVE","decision_contract":{"insufficient_evidence_disposition":"PRIMARY_SOURCE_PRIOR_INSUFFICIENT","max_candidate_variants":0,"negative_disposition":"PRIOR_REJECTS_SINGLE_BTC_DRA_TRANSFER","oos_access":"DENY","outcome_tuning":"DENY","positive_disposition":"PRIOR_SUPPORTS_ONE_VOLATILITY_MANAGEMENT_DESIGN_AUDIT","stop_condition_count":11,"stop_conditions_sha256":"f9d451222717c26ef036b07c439ca5a30b9fbdd509689a1c6554932f0ff39ba5"},"dispatch_id":"manager-dra-volatility-management-primary-prior-audit-v3","execution_mode":"READ_ONLY","issued_at":"2026-08-11T01:42:00Z","local_thread_id":"019fd621-68ce-7802-9eed-5ef87c35d677","manager_thread_id":"019fca63-4f8f-71e3-9d88-297bca468eb9","performance_case":{"causal_mechanism":"At each existing DRA entry decision, only information from lagged realized volatility may identify periods in which expected return does not compensate path risk; reducing or scaling participation before entry could avoid disproportionate drawdown without changing exits, routes, regimes, sides, carry, microstructure, or Trading authority.","claim_boundary":"This V3 task may resolve only the primary-source prior, causal distinctness, single-BTC transfer boundary, and proof needed for one later pre-outcome design audit. It cannot access strategy outcomes or establish parameters, prediction, statistical significance, fee-adjusted PnL, drawdown, fills, turnover, costs, capacity, candidate readiness, OOS value, deployability, or Trading authority.","drawdown_hypothesis":"If a later separately preregistered matched-capital experiment shows that causal volatility conditioning avoids uncompensated adverse paths without concentrating gains or sacrificing breadth, maximum drawdown may improve; this literature audit itself leaves drawdown MISSING_PROOF.","expected_direction":"DIAGNOSTIC_ONLY","opportunity_cost":"A terminal transfer verdict tests an independent mechanism family while R2 matures, preventing generic multi-factor in-sample evidence from consuming a BTC DRA experiment and permitting exactly one later pre-outcome design audit only if the full primary record survives co-equal real-time and out-of-sample falsification evidence.","performance_hypothesis":"Only a later independently frozen and validated matched-capital experiment could show positive fee-adjusted total PnL or drawdown improvement from volatility-conditioned DRA participation; this primary-literature V3 audit has zero immediate performance effect.","primary_metric":"fee_adjusted_total_pnl_delta_under_equal_capital","research_phase":"DIAGNOSTIC"},"policy_binding":{"policy_id":"AUTONOMOUS_TRADING_RESEARCH_V3","policy_sha256":"a82ccff13c13765d1e94a29698a43b35b847ed19190965590fa72e9a102981f6","primary_metric":"fee_adjusted_total_pnl_delta_under_equal_capital"},"schema_version":"1","state_authority":"SERVER_CANONICAL","task_id":"local-node-dra-volatility-management-primary-prior-audit-v3","task_sha256":"0fc2debce86444785807d944343e781e2f0e1e1c4636b781bccc6baf94a1b007","task_type":"EVIDENCE_DIAGNOSTIC","timer_authority":"CODEX_CLOUD_OPS_ONLY"}
