{"authorization":"RESEARCH_ONLY_NOT_SHADOW_PAPER_OR_LIVE","decision_contract":{"insufficient_evidence_disposition":"MISSING_PROOF_MANAGER_EXECUTABLE_VALIDATION_REQUIRED","max_candidate_variants":0,"negative_disposition":"V2_TRANSITIVE_REFREEZE_REJECTED_PRESERVE_V1","oos_access":"DENY","outcome_tuning":"DENY","positive_disposition":"EXACT_NINE_FILE_V2_OFFLINE_REFREEZE_READY_FOR_MANAGER_VALIDATION","stop_condition_count":19,"stop_conditions_sha256":"ebe3f0c2a644c93a5dc1c3d6ccf03f7c4b7f59d92ea570550ae20341f440a1d4"},"dispatch_id":"manager-dra-crypto-carry-transitive-predecessor-identity-refreeze-v1","execution_mode":"WORKTREE_WRITE","issued_at":"2026-08-09T04:49:35Z","local_thread_id":"019fd621-68ce-7802-9eed-5ef87c35d677","manager_thread_id":"019fca63-4f8f-71e3-9d88-297bca468eb9","performance_case":{"causal_mechanism":"A D-1 frozen expiry-futures inventory followed by complete confirmed D-day futures/index atoms may carry independent derivatives-crowding information for a later BTC spot DRA admission decision, but only when a dedicated-identity V2 parent proves pre-D inventory acceptance and exact D+1 reuse without relabeling immutable V1 child evidence.","claim_boundary":"Acceptance proves only a nine-file offline two-phase V2 contract and deterministic Java validation closure. It cannot prove endpoint reliability, Unix enforcement, packaging, deployment, canonical integration, registration, first forward evidence, prediction, fees, slippage, matched-capital PnL, drawdown, candidate readiness, OOS or Trading authority.","drawdown_hypothesis":"Immediate drawdown effect is zero. A future drawdown reduction remains MISSING_PROOF until lawful prospective carry evidence supports a separately preregistered matched-capital Validation and sealed OOS result.","expected_direction":"ZERO_IMMEDIATE_EFFECT","opportunity_cost":"Closing predecessor and dedicated-identity semantics before packaging prevents causally late or falsely relabelled evidence from consuming limited server, Local Research and future-data capacity.","performance_hypothesis":"The offline refreeze cannot improve fee-adjusted total PnL directly, but exact D-1/D+1/D+2 evidence identity reduces learning latency and integrity failure when later accepting or rejecting carry-conditioned DRA admission.","primary_metric":"fee_adjusted_total_pnl_delta_under_equal_capital","research_phase":"INFRASTRUCTURE"},"policy_binding":{"policy_id":"AUTONOMOUS_TRADING_RESEARCH_V3","policy_sha256":"a82ccff13c13765d1e94a29698a43b35b847ed19190965590fa72e9a102981f6","primary_metric":"fee_adjusted_total_pnl_delta_under_equal_capital"},"schema_version":"1","state_authority":"SERVER_CANONICAL","task_id":"local-node-dra-crypto-carry-transitive-predecessor-identity-refreeze-v1","task_sha256":"540e7b8a90eb73af59dbf58893007bd8221dacbfe1abab142cfc386f8c939619","task_type":"ADAPTER_IMPLEMENTATION","timer_authority":"CODEX_CLOUD_OPS_ONLY"}
