{"authorization":"RESEARCH_ONLY_NOT_SHADOW_PAPER_OR_LIVE","decision_contract":{"insufficient_evidence_disposition":"HISTORICAL_SAMPLE_OR_INTEGRITY_INSUFFICIENT","max_candidate_variants":0,"negative_disposition":"HISTORICAL_DIRECTIONAL_PRIOR_UNSTABLE_CLOSE","oos_access":"DENY","outcome_tuning":"DENY","positive_disposition":"ONE_HISTORICAL_DIRECTIONAL_PRIOR_STABLE_FOR_FORWARD_CONFIRMATION","stop_condition_count":18,"stop_conditions_sha256":"6a274d515c2c2e9fb051fc2e42919be460612e7841eb954a662a45caffc084b6"},"dispatch_id":"manager-btc-utc-day-3pct-historical-post-shock-stability-audit-v1","execution_mode":"READ_ONLY","issued_at":"2026-08-10T10:52:00Z","local_thread_id":"019fd621-68ce-7802-9eed-5ef87c35d677","manager_thread_id":"019fca63-4f8f-71e3-9d88-297bca468eb9","performance_case":{"causal_mechanism":"A complete UTC-day BTC move of at least 3 percent may create a direction-conditioned next-day state through flow persistence, forced positioning or liquidity normalization; only the same signed h24 response across frozen Design, Validation and annual breadth can distinguish a stable historical continuation or reversal prior from a concentrated retrospective pattern.","claim_boundary":"This dispatch may compute one pre-2025 historical descriptive mechanism audit from the exact sealed H1 corpus. It cannot access post-2024 or forward evidence, alter the deployed forward evaluator, define a strategy mapping, compute strategy PnL or drawdown, register a hypothesis or candidate, open OOS, deploy, change canonical state or schedule, or perform any Trading action.","drawdown_hypothesis":"Immediate drawdown effect is zero. A later independently preregistered matched-capital strategy could evaluate drawdown only after untouched forward evidence supports the same mechanism; all economic and path-risk value remains MISSING_PROOF.","expected_direction":"ZERO_IMMEDIATE_EFFECT","opportunity_cost":"Computing one frozen historical prior now prevents months of passive waiting and can close an unstable direction before strategy engineering, while keeping the cost bounded by forbidding neighboring thresholds, horizons, windows and mappings. A stable prior still waits for the unchanged forward evaluator rather than consuming candidate budget.","performance_hypothesis":"The audit itself cannot improve fee-adjusted total PnL. Its value is increasing mechanism-learning throughput and rejecting or preserving exactly one continuation or reversal prior before any matched-capital strategy specification is attempted.","primary_metric":"fee_adjusted_total_pnl_delta_under_equal_capital","research_phase":"DIAGNOSTIC"},"policy_binding":{"policy_id":"AUTONOMOUS_TRADING_RESEARCH_V3","policy_sha256":"a82ccff13c13765d1e94a29698a43b35b847ed19190965590fa72e9a102981f6","primary_metric":"fee_adjusted_total_pnl_delta_under_equal_capital"},"schema_version":"1","state_authority":"SERVER_CANONICAL","task_id":"local-node-btc-utc-day-3pct-historical-post-shock-stability-audit-v1","task_sha256":"92da73b7f900810de32ae9b61aa9fd54476fc7fa2c922473b7345a6dcaddf33c","task_type":"EVIDENCE_DIAGNOSTIC","timer_authority":"CODEX_CLOUD_OPS_ONLY"}
