{"authorization":"RESEARCH_ONLY_NOT_SHADOW_PAPER_OR_LIVE","decision_contract":{"insufficient_evidence_disposition":"BTC_BROAD_DOLLAR_VOLATILITY_EVIDENCE_INSUFFICIENT","max_candidate_variants":0,"negative_disposition":"BTC_BROAD_DOLLAR_VOLATILITY_PASSIVE_CORE_FAMILY_CLOSE","oos_access":"DENY","outcome_tuning":"DENY","positive_disposition":"BTC_BROAD_DOLLAR_VOLATILITY_HISTORICAL_CANDIDATE_FROZEN_REPORTED_NOT_ACTIVATED","stop_condition_count":6,"stop_conditions_sha256":"bfc73cf66eecafb7cc822e3403feb2e551dc80b8a2b5d18df9a2e93a8af92a09"},"dispatch_id":"manager-btc-broad-dollar-volatility-passive-core-risk-overlay-v1","execution_mode":"READ_ONLY","issued_at":"2026-08-24T11:37:10Z","local_thread_id":"inline-local-node-2026-08-24-dollar-volatility","manager_thread_id":"019fca63-4f8f-71e3-9d88-297bca468eb9","performance_case":{"causal_mechanism":"Unusually high broad-dollar volatility may identify unstable global funding and cross-currency risk transmission that raises BTC path risk even when dollar direction itself is not predictive.","claim_boundary":"This task may establish only one pre-2025 historical Design and Validation decision for exact DTWEXBGS 8-, 13- and 26-week annualized RMS volatility with a lagged 52-observation median and 100/50-percent BTC targets. It cannot inspect post-2024 data, tune any formula or gate, reinterpret dollar direction, create Trading behavior, activate a strategy or open OOS unless every frozen gate passes.","drawdown_hypothesis":"The policy is valuable only if reducing exposure to a permanent half-size BTC core during high external FX stress materially lowers drawdown and improves Calmar while preserving required upside, holding quality and terminal accounting.","expected_direction":"POSITIVE","opportunity_cost":"The external volatility state may de-risk during harmless currency repricing or after stress is already priced, forfeiting BTC upside. One frozen screen either produces a historical candidate for independent OOS or closes the exact volatility family before more macro-state work consumes capacity.","performance_hypothesis":"The primary 13-week annualized RMS DTWEXBGS weekly-log-change state improves after-cost risk-adjusted performance versus matched full-capital buy-and-hold in both Design and historical Validation, with stable 8-week and 26-week rejection-only neighbors and broad annual support.","primary_metric":"fee_adjusted_total_pnl_delta_under_equal_capital","research_phase":"DIAGNOSTIC"},"policy_binding":{"policy_id":"AUTONOMOUS_TRADING_RESEARCH_V3","policy_sha256":"a82ccff13c13765d1e94a29698a43b35b847ed19190965590fa72e9a102981f6","primary_metric":"fee_adjusted_total_pnl_delta_under_equal_capital"},"schema_version":"1","state_authority":"SERVER_CANONICAL","task_id":"local-node-btc-broad-dollar-volatility-passive-core-risk-overlay-v1","task_sha256":"ace43b7d4778bd11f8daa3d9b599612b6037529d15a8ff4d27fd30448302a9fd","task_type":"EVIDENCE_DIAGNOSTIC","timer_authority":"CODEX_CLOUD_OPS_ONLY"}
