{"authorization":"RESEARCH_ONLY_NOT_SHADOW_PAPER_OR_LIVE","decision_contract":{"insufficient_evidence_disposition":"PRIMARY_SOURCE_PRIOR_INSUFFICIENT","max_candidate_variants":0,"negative_disposition":"PRIOR_DOES_NOT_SUPPORT_OKX_INTRADAY_TRANSFER","oos_access":"DENY","outcome_tuning":"DENY","positive_disposition":"PRIOR_SUPPORTS_EXISTING_V3_SCREEN_WITH_SCOPE_LIMITS","stop_condition_count":10,"stop_conditions_sha256":"cb4e9e73270fa20054ba490b309c38cd0d34557151f59997e37592f9eafc048d"},"dispatch_id":"manager-microstructure-order-flow-literature-prior-audit-v1","execution_mode":"READ_ONLY","issued_at":"2026-08-08T07:11:00Z","local_thread_id":"019fd621-68ce-7802-9eed-5ef87c35d677","manager_thread_id":"019fca63-4f8f-71e3-9d88-297bca468eb9","performance_case":{"causal_mechanism":"Point-in-time active-buy pressure above the contemporaneous OKX book midline may contain information that persists beyond mechanical same-interval price impact into later 15- and 60-minute returns, but a single-venue signal may instead reflect cross-venue leader-lag reaction.","claim_boundary":"This task may assess only the external causal prior and the alignment of already frozen V3 gates. It cannot access outcomes, establish statistical significance, PnL, drawdown, fees, fills, capacity, candidate readiness, OOS value, or any Trading authority.","drawdown_hypothesis":"If later economic evidence shows that the frozen signal avoids adverse short-horizon paths rather than merely following contemporaneous impact, maximum drawdown may improve versus matched controls; this prior audit itself leaves drawdown MISSING_PROOF.","expected_direction":"DIAGNOSTIC_ONLY","opportunity_cost":"A scope-correct prior can prevent spending the later 42-day economic cycle on a mechanism that only explains contemporaneous impact or another venue's price discovery, while an over-strict prior could wrongly discard a useful forward association that the frozen V3 screen can cheaply test.","performance_hypothesis":"Only if the frozen V3 next-minute 15/60-minute screen later passes and the separate 30-bps matched-capital route also passes may the mechanism improve fee-adjusted total PnL; literature support alone has zero immediate performance effect.","primary_metric":"fee_adjusted_total_pnl_delta_under_equal_capital","research_phase":"DIAGNOSTIC"},"policy_binding":{"policy_id":"AUTONOMOUS_TRADING_RESEARCH_V3","policy_sha256":"a82ccff13c13765d1e94a29698a43b35b847ed19190965590fa72e9a102981f6","primary_metric":"fee_adjusted_total_pnl_delta_under_equal_capital"},"schema_version":"1","state_authority":"SERVER_CANONICAL","task_id":"local-node-microstructure-order-flow-literature-prior-audit-v1","task_sha256":"d7a0057e795b3199df4f834012c9bd90f171257bef84bbdd6fcee9dbe6ba349f","task_type":"EVIDENCE_DIAGNOSTIC","timer_authority":"CODEX_CLOUD_OPS_ONLY"}
