{"authorization":"RESEARCH_ONLY_NOT_SHADOW_PAPER_OR_LIVE","decision_contract":{"insufficient_evidence_disposition":"CARRY_PREDECESSOR_CONTRACT_GAP_REQUIRES_OFFLINE_REFREEZE","max_candidate_variants":0,"negative_disposition":"CARRY_DEPLOYMENT_ARCHITECTURE_INSUFFICIENT_CLOSE","oos_access":"DENY","outcome_tuning":"DENY","positive_disposition":"CARRY_UNIX_ISOLATION_READY_FOR_BOUNDED_IMPLEMENTATION","stop_condition_count":15,"stop_conditions_sha256":"520a46208b5d02b6e3b13d3f4ffc89022b2ca3740d09a019e032322e4c324a17"},"dispatch_id":"manager-dra-crypto-carry-unix-isolation-deployment-audit-v1","execution_mode":"READ_ONLY","issued_at":"2026-08-09T04:19:55Z","local_thread_id":"019fd621-68ce-7802-9eed-5ef87c35d677","manager_thread_id":"019fca63-4f8f-71e3-9d88-297bca468eb9","performance_case":{"causal_mechanism":"A causally frozen D-1 expiry-futures inventory followed by complete confirmed D-day futures and index atoms may reveal derivatives crowding before a later BTC spot DRA admission decision, but only if Unix isolation and the one-way chain prevent retrospective instrument selection and same-day leakage.","claim_boundary":"This read-only audit may freeze only a deployment architecture and ordered bounded implementation slices. It cannot prove endpoint reliability, Unix enforcement, deployment, source registration, first future evidence, prediction, fees, slippage, matched-capital PnL, drawdown improvement, candidate readiness, OOS or Trading authority.","drawdown_hypothesis":"Immediate drawdown effect is zero. Any future drawdown reduction remains MISSING_PROOF until the lawful prospective carry chain supports a separately preregistered matched-capital Validation and sealed OOS result.","expected_direction":"ZERO_IMMEDIATE_EFFECT","opportunity_cost":"Detecting a missing prior-inventory transport or unsafe shared identity before packaging prevents deployment of causally unusable evidence and avoids consuming the limited server and Local Research capacity on a source that cannot support a valid performance test.","performance_hypothesis":"The isolation audit cannot improve fee-adjusted total PnL directly, but a correct single-clock D-1/D+1/D+2 architecture reduces learning latency and evidence-integrity failure when accepting or rejecting the carry-conditioned DRA admission mechanism.","primary_metric":"fee_adjusted_total_pnl_delta_under_equal_capital","research_phase":"INFRASTRUCTURE"},"policy_binding":{"policy_id":"AUTONOMOUS_TRADING_RESEARCH_V3","policy_sha256":"a82ccff13c13765d1e94a29698a43b35b847ed19190965590fa72e9a102981f6","primary_metric":"fee_adjusted_total_pnl_delta_under_equal_capital"},"schema_version":"1","state_authority":"SERVER_CANONICAL","task_id":"local-node-dra-crypto-carry-unix-isolation-deployment-audit-v1","task_sha256":"8a5d487c5b708bf841f314a588b053fee85ddc86646abd4c2409240383d80b60","task_type":"EVIDENCE_DIAGNOSTIC","timer_authority":"CODEX_CLOUD_OPS_ONLY"}
